title_id,title,genre,authors,weekdays,length,subscribers,rating,views,likes,status,daily_pass,synopsis
1690,Mind core ภาวะของหัวใจ,DRAMA,Pavida Yingprasert,TUESDAY,5,65432,9.63,2455656,106059,COMPLETED,True,เพราะอุบัติเหตุครั้งนั้น ทำให้นักวิ่งอนาคตไกลอย่างเขา ต้องสูญเสียความหวังที่มี และจมอยู่กับความเศร้า แต่ท่ามกลางความมืดมิด ยังมีดวงดาว เมื่อหุ่นยนต์อย่างเธอก้าวเข้ามาในชีวิต และนำทางเขาไปสู่ความหวังครั้งใหม่
1689,ตึกตักตึกตัก ปิดเล่มรัก นักเขียนสุดแซ่บ,ROMANCE,"ยอนดู,ซองอี",WEDNESDAY,5,242041,9.18,9769524,326878,COMPLETED,True,"ฉันชื่อ ""อันตึลเอบม"" เป็นนักเขียนฝึกหัดมาตลอด9ปี...ในที่ฉันก็ผ่านการสัมภาษณ์แล้ว!
แต่นี่อะไรนะ? ฉันไม่ใช่ 'นักเขียน' แต่ถูกเลือกให้เป็น 'ผู้รับผิดชอบ'งั้นเหรอ?"
1671,กรุ่นไอรักรสช็อกโกแลต,ROMANCE,Ann,SATURDAY,88,307669,9.35,19803510,857815,HIATUS,False,กรุ่นกลิ่นความรักรสช็อกโกแลตไปกับสาวน้อยริริ และบาริสต้าหนุ่มรุ่นพี่ที่บังเอิญอยู่ที่โรงเรียนเดียวกัน!
1670,Take My Money รักนี้...มีเปย์,ROMANCE,AlohaDRY,THURSDAY,131,685554,9.82,63574609,1946779,HIATUS,False,"เมื่อรักแรกพบของคุณหนูไฮโซอย่างมีนา คือรุ่นพี่สุดเย็นชาที่คณะ 
พบกับภารกิจเปย์เพื่อมัดใจเจ้าชายในฝัน ! ใจพร้อม เงินก็พร้อมค่ะ !!  #มีนาโอนไวพี่ไหวหรือเปล่าคะ"
1668,มเหสีหลงยุค ยินดีให้บริการค่ะ,ROMANTIC_FANTASY,"Peralta,GUA",THURSDAY,47,375448,9.76,17568896,616920,ONGOING,False,มิติใหม่แห่งการหลงยุค จากเจ้าหน้าที่คอลเซ็นเตอร์ มาเป็นมเหสี!?! แถมยังต้องมารับใช้จักรพรรดิบ้าเลือด!! นี่ฉันต้องงัดทุกสกิลมาใช้เพื่อให้มีชีวิตรอดเลยมั้ย?
1656,JON คุณชายไร้สติ,BL_GL,ยืนกินปากกาที่ท่าพระ,MONDAY,7,344536,9.85,12207591,444983,COMPLETED,True,"ชีวิตวัยรุ่นที่แสนสงบสุขของเอื้องเหนืออยู่ดีๆก็ต้องหยุดชะงัก เมื่ออยู่ดีๆ เขาก็มีเพื่อนร่วมบ้านคนใหม่มาอยู่ด้วย
นอกจากไอ้หมอนี่จะหน้าตาดีเกินหูเกินตา ยังขยันสร้างปัญหาให้เขาไม่เว้นแต่ะละวัน! เอื้องเหนือจะรับมือกับความใสซื่อจนหน้าโมโหนี่ยังไงดีล่ะเนี่ย?!"
1655,มนุษย์ทมิฬ,ACTION,ลีชอนยอก,MONDAY,6,204590,9.88,15443590,531228,COMPLETED,True,เมื่อวันหนึ่งผมได้สูญเสียครอบครัวและการมองเห็นไป แต่ผมกลับได้เพื่อนใหม่ในความมืดที่ไม่มีใครรับรู้ได้ เกิดอะไรขึ้นกับตัวผม ทำไมคนพวกนี้ถึงนองเลือดอยู่บนพื้น
1654,เหยื่อ,HORROR,"เวนุนพักอี,Park, su bong",SUNDAY,7,204295,9.82,14663865,657795,COMPLETED,True,"เรื่องเล่าจากเด็กสาวที่มองเห็น... สิ่งที่อยู่ตรงนั้น
พวกเธออยากเห็นสิ่งที่น่ากลัวจริงๆ หรือเปล่า? "
1650,เมื่อฉันหลงเข้าไปอยู่ในยุคสามก๊ก,FANTASY,"B. DALGUNG,อียูจอง, ซาบังพัทปัง",MONDAY,6,152206,8.53,6536904,214839,COMPLETED,True,"ฉันชื่อ “เชนา” ใครๆ ก็ชมว่าฉันทั้งสวยทั้งเก่ง เรื่องความสามารถด้านธุรกิจและการบริหารก็ไม่เป็นรองใคร แต่เมื่อฟื้นมาอีกทีหลังจากถูกรถชน ฉันก็ได้พบกับสามหนุ่มสุดหล่อ “เตียวหุย” , “กวนอู” และ “เล่าปี่” เอ๋~~~ นี่ฉันหลงเข้ามาอยู่ในยุค “สามก๊ก” หรือเนี่ย?!!!
*เว็บตูนเรื่องนี้ได้รับแรงบันดาลใจ และดัดแปลงจากวรรณกรรมเรื่องสามก๊ก"
1637,ลิขิตรักข้ามมิติ,FANTASY,"รัมกึล,RYU",WEDNESDAY,6,287743,9.78,14198419,567493,COMPLETED,True,"ได้รับการตรวจสอบแล้ว
จากนักธนูเหรียญทองโอลิมปิก มาเกิดใหม่เป็นเจ้าหญิงยุคโบราณที่รายล้อมไปด้วยศัตรูและหนุ่มหล่อ! ""ฉันต้องใช้ความสามารถจากชาติก่อนมาเป็นที่หนึ่งในชาตินี้ให้ได้!"""
1636,ลุ้นรักป่วนใจนายไฮโซ,ROMANCE,คิมจิซู,WEDNESDAY,12,282114,9.7,20604926,842277,COMPLETED,True,"""พอเข้ามหา'ลัยแล้วจะต้องเปลี่ยนชีวิตให้ดีขึ้นให้ได้!""
""ซาฮัม"" นักศึกษาใหม่ผู้ยากไร้ที่ตั้งใจเปลี่ยนชีวิตตัวเองให้ดีขึ้น กลับต้องแกล้งทำตัวเป็นไฮโซอยู่ท่ามกลางบรรดาลูกเศรษฐีตัวจริง งานนี้ จะโป๊ะแตกก่อน หรือตกหลุมรักก่อนกันนะ?!"
1635,มังกรตัวร้ายกับนายติวเตอร์,FANTASY,eon,SUNDAY,125,118537,9.69,5422150,259757,ONGOING,False,ผม “ยูชานยอง” เป็นติวเตอร์ผู้มีชื่อเสียง ไม่ว่าจะสอบอะไร “เทพผ่านเกรด A” อย่างผมก็สามารถช่วยให้สอบผ่านได้ทั้งนั้น แม้แต่การติวเพื่อสอบเป็น “มังกร” ก็ตาม!? อะไรนะ?! มังกร?!! พูดบ้าอะไรเนี่ย?!!!!
1634,อุบัติรักต้องคำสาป,FANTASY,manubi,SATURDAY,13,208416,9.66,7624695,309571,COMPLETED,True,"เรื่องราวความรักสุดประหลาดที่เกิดจากคำสาปของเทพเจ้า มันคือรักสามเส้าระหว่างคนและภูติงั้นหรือ?!
"
1633,It's Mine เธอเป็นของฉัน,THRILLER,LuckS,TUESDAY,147,254775,9.8,16211240,683577,ONGOING,False,จะต้องทำยังไง ถึงจะเข้าไปชวนเธอคุยได้แบบเนียนๆ นะ?
1627,I Will Die Soon,DRAMA,"ลีวอนชิก,กุลชาน",THURSDAY,7,164185,9.79,11735314,372767,COMPLETED,True,"ตกงาน ถังแตก แถมถูกแฟนที่คบมา 6 ปีบอกเลิก ""ชเวอีแจ"" ตัดสินใจฆ่าตัวตายเพราะอยากจบทุกสิ่ง หารู้ไม่ว่า นั่นคือจุดเริ่มต้นของบทลงโทษอันแสนหนักหน่วง โทษฐานที่ไม่เคารพความตาย เขาตายไปแล้ว และจะตายอีกครั้ง ...เร็วๆ นี้...He will die soon..."
1626,เปลี่ยนยัยตัวร้ายให้เป็นยัยน่ารัก,ROMANCE,Yoo Jong Pyo,SUNDAY,14,270529,8.77,19329102,474122,COMPLETED,True,ผมก็แค่นายเจี๋ยมเจี้ยมคนหนึ่งที่ดันเผลอไปจูบยัยตัวร้ายที่น่ารักสุดๆ เข้า ต่อจากนี้ ชีวิตในโรงเรียนมัธยมปลายของผมจะเป็นไงต่อไปนะ?!
1625,อยู่ๆ ฉันก็กลายเป็นเจ้าหญิง,ROMANTIC_FANTASY,"Plutus,Spoon",WEDNESDAY,115,1114027,9.87,125105343,3793130,ONGOING,False,จะทำอย่างไรถ้าฉันกลายเป็นตัวละครในนิยาย...ที่ต้องตายตอนอายุ 18
1614,ตกหลุมรัก นายช่างแต่งหน้า,DRAMA,LEE YEON,MONDAY,7,331465,9.72,19961157,928857,COMPLETED,True,คิมเยซึล สาวหน้าตาบ้านๆที่อยากจะสวยเหมือนกับคนอื่นๆ โชคชะตาพาให้เธอมาพบกับเมคอัพอาร์ทิสต์มือหนึ่งชอนซูยอง เพื่อที่จะชนะการแข่งขันรายการแต่งหน้า ทำให้เขาทั้งคู่ต้องร่วมมือกัน!
1611,Killstagram,THRILLER,Ryoung,WEDNESDAY,5,399543,9.71,30999676,985077,COMPLETED,True,"ชอบเล่นโซเชียลแต่คิดว่าจะไม่ต้องเจออะไรแบบโดเรมีสินะ
อย่าเพิ่งวางใจ... เพราะคุณถูกเชิญให้เข้าร่วมเกมวิญญาณสังหารแล้วล่ะ!"
1602,ดอกไม้ของแวมไพร์,ROMANTIC_FANTASY,BULSA,MONDAY,54,266555,9.7,15896662,576430,COMPLETED,True,ผู้ที่ได้ดอกไม้ของแวมไพร์ไปครอบครองจะอยู่เหนือคนทั้งโลก!
1600,แอนตี้แฟนกับนายท็อปสตาร์จอมเฟค,ROMANCE,Jaerim,THURSDAY,7,463181,9.71,27458861,923852,COMPLETED,True,เว็บตูนต้นฉบับซีรีส์! <So I Married The Anti Fan> เพราะนายซุปตาร์คนนี้แท้ๆ ที่ทำให้เธอต้องตกงาน เธอจึงตั้งใจจะเป็นแอนตี้แฟนเพื่อรังควานชีวิตเขา!!
1596,เกิดอีกที ขอเป็นคนดีได้ไหม(วะ)?,DRAMA,"SAYEOL,yerang,Okks",THURSDAY,7,316115,9.81,27835774,779818,COMPLETED,True,เมื่อลุงหัวหน้าแก๊งมาเฟียได้เกิดใหม่ในร่างนักเรียนม.ปลาย?! เขาจะใช้โอกาสนี้เปลี่ยนตัวเองเป็นคนดีได้หรือไม่?
1595,Study Group,ACTION,"ชินฮยองอุก,ยูซึงยอน",SUNDAY,143,684150,9.88,59433636,1905041,ONGOING,False,"ความหวังเดียวที่จะทำให้ผมได้เข้ามหาวิทยาลัยปกติได้คือการเข้าโรงเรียนที่มีพวกอันธพาลเพื่อสร้างเกรดดี!! 
"
1594,Listen to me ,HEARTWARMING,แมวอ้วนถลาลม,SUNDAY,5,254824,9.75,11538724,469789,COMPLETED,True,"เพื่อนในจินตาการที่ไม่ควรมีตัวตนอยู่จริง กลับมาปรากฏตัวอยู่ตรงหน้า!!
เมื่อเขากลับมาหาเธออีกครั้ง ในครั้งนี้จะช่วยปกป้องเธอจากโลกแห่งความเป็นจริงที่โหดร้ายได้หรือไม่? "
1568,Lily Boy อยากสวยช่วยผมหน่อย,BL_GL,Sochicz,MONDAY,7,386904,9.82,31742926,1263426,COMPLETED,True,"เมื่ออยู่ๆพี่สาวสุดที่รักก็ขนข้าวของออกจากบ้านอย่างกระทันหัน แถมยังหวังดีกลัวน้องชายอย่าง ""พักรบ"" จะลำบาก จึงส่งหนุ่มฮอตฉายาเทวดาปากสวะ ""สิงหา"" มาอยู่เป็นเพื่อน  แต่ว่าพักรบนั้นมีความลับสำคัญที่ต้องปกปิด สิ่งนั้นก็คือ..!?
"
1565,DEAD LIFE,THRILLER,"เฟรชช่า,อิมจินกุก",TUESDAY,8,345746,9.77,26767689,744777,COMPLETED,True,ท่ามกลางซากศพเดินได้ที่มีอยู่ทั่วเมือง ซอมบี้สายพันธุ์ใหม่ปรากฏตัวขึ้น พวกมันทั้งไวกว่า ฉลาดกว่า และโหดกว่า! แล้วมนุษย์ที่เหลืออยู่จะตกเป็นเหยื่อ หรือกลายเป็นพวกเดียวกับมัน?!
1564,กลโกงโลกพนัน,DRAMA,"ฮันดงอู,ลีโดฮี",MONDAY,160,304927,9.82,22051842,700561,ONGOING,False,ความรุนแรงในโรงเรียนที่มีอำนาจและเงินตราเป็นเครื่องเดิมพัน นักเรียนทุกคนต้องยอมจำนนต่อกฎนี้ แม้แต่อาจารย์ก็เพิกเฉย นักเรียนใหม่อย่าง “ดันกอนอู” จะสามารถปฏิวัติโรงเรียนนี้ได้หรือไม่
1563,ระหว่างเรา...,ROMANCE,คิมอินจอง,SATURDAY,3,149813,9.53,8473004,236066,COMPLETED,True,“จีวอน” สาววัย 29 มีเรื่องไม่กล้าบอกใครเกี่ยวกับความรัก 5 ปีที่เริ่มจืดชืด เธอบังเอิญได้เจอเพื่อนเก่า “ฮันน่า” ที่กลายเป็นนักเขียนผู้ช่ำชองเรื่องบนเตียง ฮันน่าจึงอาสาเป็นที่ปรึกษาเรื่องอย่างว่าให้จีวอน ความสัมพันธ์ของสองเพื่อนเก่าที่ดูเหมือนจะดี แต่แท้จริงแล้ว อาจไม่เป็นอย่างที่เห็น
1544,รักนี้ไม่มีรีทัช,DRAMA,"jellyfish,Dohin.e",TUESDAY,11,302388,9.59,24838732,977044,COMPLETED,True,“ซูจี” ที่กำลังมาแรงในฐานะเน็ตไอดอลสาวสวย จน “ลูซิเฟอร์” ซุปตาร์หนุ่มหล่อขอคบเป็นแฟน แต่ไม่มีใครรู้เลยว่า ความสวยของเธอมาจากแอพแต่งรูปล้วนๆ!!
1543,โอ้! นายผู้ช่วยของผม,BL_GL,"MILA,AngryMonster(Yalgae)",SUNDAY,3,366510,9.8,21701930,605764,COMPLETED,True,นักเขียนการ์ตูนอีโรติกที่หมดอารมณ์กับเรื่องรักๆใคร่ๆไปแล้วอย่างผม กลับมาใจเต้นตึกตักกับผู้ช่วยหนุ่มหล่อรวยเก่งคนนี้! เอาจริงดิ?! ผู้ชายเหมือนกันเนี่ยนะ?!
1542,ร้านดอกไม้ต้องห้ามของเวนดี้,ROMANTIC_FANTASY,"Bize,sizh",MONDAY,8,466028,9.81,39033139,1316480,COMPLETED,True,เวนดี้ สาวสวยเจ้าของร้านดอกไม้ผู้เก็บตัว และไม่เชื่อในความรัก จนกระทั่งเขาเข้ามา และพยายามทำลายกำแพงในหัวใจของเธอ
1533,Honey Honey Wedding,WEB_NOVEL,"โนซึงอา,บาร์ท",SATURDAY,14,91452,8.53,5088450,31710,COMPLETED,True,"เรื่องรักต่างวัยที่ครองใจนักอ่านเกาหลีกว่า 5 ล้านคน
พร้อมให้คนไทยได้อ่านในเวอร์ชันนิยายแล้ว"
1532,WEAK HERO,ACTION,"เซอร์แพส,คิมจินซอก",WEDNESDAY,166,439634,9.86,53743209,1485019,ONGOING,False,"ถึงจะตัวเล็กบอบบางเหมือนผู้หญิง แต่ไหวพริบในการต่อสู้ไม่เคยเป็นรองใคร
ไม่ว่าหน้าไหนก็เข้ามาเลย!"
1526,ภารกิจรัก ปลดคำสาปร้าย,DRAMA,หมีเผือก,TUESDAY,5,234632,9.77,16110499,694337,COMPLETED,True,"เพราะเกิดมาด้วยต้นทุนสูงลิ่ว หล่อ รวย เพอร์เฟ็กต์ จึงไม่เคยมีใครกล้าขัดใจ ""จูโน่"" เลยซักครั้ง
หากแต่ความผยองทำให้เขาต้องตกอยู่ใต้คำสาปร้าย  
ถ้าเขาทำให้เธอรักไม่ได้ ชีวิตของเขาจะจบลงใน 365วัน"
1520,ยมทูตเจ้าเสน่ห์,ROMANCE,"เฮียรี,ซังพิล",SATURDAY,10,429519,9.84,26756720,969486,COMPLETED,True,"ฉัน ฮันจีอัน นักแสดงโนเนมที่ไม่ค่อยมีงาน  ต้องมาตกบันไดตายเพราะแฟนคลับของจินซอวอน ซูเปอร์สตาร์ชื่อดัง 
ว่าแต่...ที่จริงแล้วจินซอวอนคือยมทูตที่จะพาฉันไปงั้นเหรอ...?! นี่มันไม่จริงใช่มั้ย!!! ฉันยังไม่อยากไปปรโลกนี่นา ไม่สิ ฉันไม่ควรต้องไป!"
1511,Love Attack ปฏิบัติการรักรุ่นพี่,BL_GL,NAN,WEDNESDAY,1,354800,9.76,17878392,528287,COMPLETED,True," “ถ้ารสนิยมรุ่นพี่เป็นแบบนี้ งั้นฉันก็จะเปลี่ยน!!”
หลังถูกรุ่นพี่โดวอนปฏิเสธรัก ฮงกินยาประหลาดที่ได้รับจากหญิงแปลกหน้าเข้าไปแล้วกลายเป็น ""ฮยอน"" หนุ่มหล่อที่ตรงตามสเปกของรุ่นพี่ และเดินหน้าจู่โจมรักต่อรุ่นพี่โดวอนหนักหน่วงขึ้น?! ความรักอันแน่วแน่มั่นคงของฮยอนที่มองแต่รุ่นพี่ คิดถึงแต่รุ่นพี่ จะแฮปปี้เอ็นดิ้งหรือไม่ล่ะเนี่ย?!
"
1510,SAVE ME,DRAMA,"Big Hit Ent. ,LICO",THURSDAY,1,302489,9.91,6414732,241419,COMPLETED,True,"""ถ้าหากสามารถย้อนเวลากลับไปแก้ไขความผิดพลาด  
และมีความสุขด้วยกันทั้งหมดเหมือนเมื่อก่อนได้ ไม่ว่าอะไรฉันก็ทำได้ทั้งนั้น""

เมื่อโชคชะตานำพาเขาทั้ง 7 คนมาพบกัน
จึงเกิดเป็นเรื่องราวแสนเศร้าในช่วงเวลาที่สวยงามที่สุดของชีวิต"
1505,Touched Love สัมผัสรักล้นใจ,ROMANCE,PuGun25,MONDAY,5,257557,9.78,11925231,481605,COMPLETED,True,"พี่ฉลาม..รุ่นพี่ที่มีข่าวลือว่าเป็นเกย์คนนั้น เป็นเจ้าของน้องแมวที่หลงเข้ามาในห้องฉันงั้นเหรอ !?! 
แล้วทำไมถึงสลบลงไปนอนกับพื้นแบบนั้นล่ะ... นี่มันเรื่องอะไรกันเนี่ย  !?"
1501,ฮันนัมดง เคย์เฮ้าส์,ROMANCE,ปาร์คแทจุน,THURSDAY,5,298939,9.8,12754149,462706,COMPLETED,True,"ฮันนัมดง K เฮาส์ แหล่งรวมตัวของเทพบุตรสุดหล่อทั้ง 4 
พวกเขาต่างมีความลับที่ซ่อนไว้...มันคืออะไรกันนะ?!"
1497,Wonderful Day ,SLICE_OF_LIFE,Various Artists,"MONDAY,TUESDAY,WEDNESDAY,THURSDAY,FRIDAY,SATURDAY,SUNDAY",7,47791,9.52,1422608,35634,COMPLETED,False,LINE STORE ร่วมกับ LINE WEBTOON ขอเสนอ รวมเว็บตูนตอนพิเศษ ให้คุณรู้จัก LINE STORE มากยิ่งขึ้น
1495,ขออีกทีนะ,DRAMA,"ฮงซึงพโย,คุคุ",SUNDAY,1,57970,9.61,4601279,148266,COMPLETED,True,คู่รักที่แต่งงานกันมา 8 ปีหลังจากพบกันในมหาวิทยาลัย ตอนนี้กลายเป็นคู่รักที่เบื่อหน่ายซึ่งกันและกัน วันหนึ่งพวกเขาได้มีโอกาสย้อนเวลากลับไปใช้ชีวิตในวัยหนุ่มสาวอีกครั้ง ..พวกเขาจะมีความสุขมากขึ้นหรือไม่?!
1492,SPERMAN,COMEDY,ฮาอิลกวอน,SATURDAY,3,299955,9.54,23807259,343648,COMPLETED,True,"คิมกิดู หนุ่มซิง 100% แม้จะมีแฟน แต่ก็ยังไม่เคยไปถึงขั้นนั้นกันเลย 
มีแต่เขาเท่านั้นที่จะปกป้องมนุษยชาติได้...ด้วยพลังทางเพศ?! 
ฮีโร่สายหื่นคนแรกของโลกได้ปรากฏตัวขึ้นแล้ว!"
