title_id,title,genre,authors,weekdays,length,subscribers,rating,views,likes,status,daily_pass,synopsis
3316,พระชายาผู้ฆ่าหมีขยี้วังมังกร,WEB_NOVEL,RabbitRose,WEDNESDAY,34,25907,9.54,498546,13398,ONGOING,False,สำหรับหญิงสาวผู้เกิดใต้ดาวแห่งความซวยอย่าง ‘เหม่ยเจิน’ เคราะห์ร้ายครั้งนี้ ดูจะหนักหนาสาหัสกว่าทุกครั้งในชีวิต เมื่อเธอเกิดพลัดตกจากยอดเขา ขณะที่อยู่ในระหว่างท่องเที่ยวกับครอบครัว แต่แทนที่เธอจะกระแทกพื้นจนร่างกายแหลกเหลวเสียชีวิต หญิงสาวชาวไทยเชื้อสายจีนกลับฟื้นขึ้นมาและพบว่าตนเองติดอยู่ในโลกอีกโลกหนึ่ง แถมเธอยังกลายเป็นเครื่องสังเวยให้แก่ราชามังกรรูปงามนาม 'ต้าจินหลง' โดยไม่รู้ตัว แต่แค่นี้มีหรือเหม่ยเจินจะเอาตัวรอดไม่ได้ มี 'ความซวย' เป็นอาวุธเสียอย่าง ใครอยากลองดีก็เข้ามาเลย!
3315,Lovely Debor ผมจะยอมเป็นสามีคุณเพื่อใช้หนี้,WEB_NOVEL,Jenny D Renger,SATURDAY,32,24888,8.9,400371,7834,ONGOING,False,‘เจ’ ลูกสาวจากครอบครัวที่ร่ำรวยต้องการที่จะทวงเงินจากครอบครัวเพื่อนของพ่อตัวเองที่ยืมเงินไปหมุนธุรกิจราวสิบล้าน ทว่าบริษัทของพวกเขามีทีท่าจะล้มละลาย เธอเลยรีบตามไปทวงเงินถึงที่บ้าน เมื่อไปถึงกลับพบว่าทั้งครอบครัวบินไปต่างประเทศเรียบร้อยแล้ว เหลือเพียง ‘จิน’ ลูกชายคนเดียวที่นั่งเล่นแท็บเล็ตทำตัวไม่รู้ร้อนรู้หนาว พอเธอทวงถามเงินที่ติดค้างแล้ว เขายังทำตัว ไม่มี ไม่หนี ไม่จ่าย นอกจากจะไม่ได้เงินคืนแล้ว จินยังเสนอตัวแต่งงานล้างหนี้โดยที่เธอไม่ได้ต้องการอีกต่างหาก!!
3314,Utopia ลำนำรักเจ้าชายในฝัน ตอน ศึกรักบัลลังก์พิศวาส,WEB_NOVEL,Queen B,SATURDAY,7,10847,9.75,187826,5191,COMPLETED,True,"""ทาร์ชา"" หญิงงามที่อาศัยอยู่ในดินแดนยูโทเปีย ดินแดนในฝันที่เปี่ยมไปด้วยความสงบสุข ทว่า เรื่องราวในชีวิตของเธอกลับไม่เป็นเช่นนั้น เมื่อจู่ ๆ ""อีสเตอร์"" คนรักของเธอจำต้องตัดความสัมพันธ์เพื่อขึ้นเป็นองค์รัชทายาท เธอเข้าใจดีว่าทุกสิ่งนี้คือทางเดินที่อีกฝ่ายเลือกเพื่อชาติและบ้านเมือง แต่หัวใจของเธอกลับร่ำร้องทวงคืนตำแหน่งข้างกายเขา และนั่นนำให้เธอได้พบเจอกับ ""เอเดน"" เจ้าชายผู้มีใบหน้าราวถอดแบบมาจากอีสเตอร์ ใบหน้าที่ทำให้จิตใจของเธอสั่นคลอน แต่ใครกันล่ะที่จะเป็นผู้ครอบครองหัวใจของเธออย่างแท้จริง..."
3313,The invisible boy next to me,WEB_NOVEL,มุกดอง,SATURDAY,1,5827,9.24,60815,1378,COMPLETED,True,คุณเคยสังเกตมั้ยว่าเพื่อนข้างโต๊ะของคุณเป็นคนยังไง? สำหรับฉัน เขาเป็นผู้ชายปริศนาที่ชอบหายตัวไปอย่างปริศนาที่ไม่รู้ทำไม…ฉันถึงต้องหันไปสนใจอยู่เรื่อย
3303,ยุคแห่งความป่าเถื่อน,ACTION,"ชินอึยชอล,จางแดฮยอน",SUNDAY,32,77506,9.62,2177461,75648,ONGOING,False,"ฉันพบคนที่มีหน้าเหมือนฉัน และเกิดวันเดียวกับฉันในโซเชียลเน็ตเวิร์ก 
ต่างจากฉัน คนที่ไม่รู้แม้กระทั่งอดีตของตัวเอง และโตมาในสถานเลี้ยงเด็กกำพร้า

แต่ฉันคนนั้นที่ฉันเห็นในโซเชียลเน็ตเวิร์กดูเป็นเด็กเรียนดี มีครอบครัวที่รวยมาก ฉันพยายามหาทางพบเขาเพื่อหาเบาะแสเรื่องราวในอดีตของฉัน แต่กลับถูกดึงเข้าไปเกี่ยวข้องในสถานการณ์วุ่นวายที่ฉันไม่คาดคิด..."
3302,สงครามนักรบผู้หวนคืน,FANTASY,"นาลัค,พุงแบ๊ก",SATURDAY,32,117248,4.82,3527094,83408,ONGOING,False,พัคจองซู นักรบผู้กอบกู้อีกโลกหนึ่งได้ย้อนคืนกลับสู่โลกเดิมเพื่อแก้แค้น คิมมินซู นักรบผู้ฆ่าครอบครัวของเขา นี่คือเรื่องราวของนักรบที่ปราศจากตอนจบแสนสุข เพราะมันคือการห่ำหั่นนักรบด้วยกันเอง!
3301,ดรูอิดแห่งสถานีโซล,FANTASY,"ฮวัลซองกม,มุนซองโฮ,จินซอลอู",WEDNESDAY,32,219141,9.71,8355761,215197,ONGOING,False,"""พัคซูโฮ"" กลับมายังโลก หลังจากที่ตกไปอีกโลกนับพันปี ในขณะเดียวกัน โลกที่ซูโฮเคยอาศัยอยู่ได้กลายเป็นสนามรบตั้งแต่มีมอนสเตอร์ปรากฏตัวจากอีกโลกหนึ่ง  จากนี้ไป พัคซูโฮ ดรูอิดผู้รอดชีวิตจากป่าอันโหดร้ายและกลายเป็นราชาแห่งสัตว์ ได้เริ่มต้นการต่อสู้เพื่อพิชิตโลก!"
3300,SAMADHI,FANTASY,"ลีวอนชิก,กุลชาน",SUNDAY,33,82401,9.53,2133872,77936,ONGOING,False,"การศึกษาไม่ได้ดีเด่น รายได้ก็ไม่มาก ""คิมอีพัก"" หนุ่มอายุ 29 มีความปรารถนาเพียงหนึ่งเดียว นั่นก็คือการใช้ชีวิตแบบคนธรรมดา ๆ ให้ได้ แต่สำหรับคิมอีพักที่ยังหางานทำไม่ได้และต้องมาทำงานพาร์ตไทม์กะดึกทุกคืนนั้น มาตราฐานของคำว่า ""ธรรมดา"" ของสังคมจึงดูสูงเสียเหลือเกิน
อยู่มาวันหนึ่งเขาก็ได้พบกับ ""ฮวังมก"" เพื่อนสมัยเข้ารับการเกณฑ์ทหารในรอบ 8 ปีโดยบังเอิญ และฮวังมกก็บอกวิธีพัฒนาพลังเหนือธรรมชาติให้กับคิมอีพัก..."
3299,บันทึกคืนหลอน,HORROR,ยุกกง,TUESDAY,33,53085,9.67,1990201,85989,ONGOING,False,จากความฝันสุดสยองของนักเขียน สู่บันทึกฝันร้ายที่น่ากลัวที่สุด! นี่คือเรื่องจริง หรือความฝันกันแน่?!! พบกับเรื่องราวของฝันร้ายสุดประหลาดที่ค่อย ๆ กลืนกินชีวิตปกติสุขทีละน้อย
3298,เกมรักคว้าหัวใจจักรพรรดิ,ROMANTIC_FANTASY,"kiki,DK,GOYO",MONDAY,32,125516,9.6,3478678,136213,ONGOING,False,หลังจากตั้งใจเรียนมาอย่างยาวนานและหนักหน่วง ในที่สุด 'ราฮยอน'​ ก็สอบผ่านอย่างที่ตั้งใจ ด้วยความที่เธอดีใจมาก จู่ ๆ ดันหัวใจวายตายซะอย่างนั้น เมื่อลืมตาอีกที เธอได้พบกับบุคคลลึกลับที่คาดว่าน่าจะเป็น 'พระเจ้า'​ และชวนให้เธอเล่นเกมชิงหัวใจของจักรพรรดิในต่างโลก เธอต้องทำให้จักรพรรดิผู้เย็นชาตกหลุมรักให้ได้ เพื่อแลกกับการกลับมามีชีวิตอีกครั้ง!
3297,เพียงตะวันจันทร์เจ้าขา,WEB_NOVEL,ดวงมาลย์,SUNDAY,9,8152,9.44,157718,4176,COMPLETED,True,"ความบาดหมางระหว่างคนสองตระกูลกำลังจะจางหาย 
กลับกลายเป็นสายใยรักถักทอ นำความสุขหวนคืนอีกครั้ง
ด้วยฝีมือของวิญญาณสาว และผู้หญิงที่เธอหมายมาดว่าจะได้เป็นลูกสะใภ้!
"
3296,เก็บรักไว้ที่ปลายฟ้า,WEB_NOVEL,ดวงมาลย์,SUNDAY,10,6761,9.49,133301,3792,COMPLETED,True,"กวินทร์ หมอหนุ่มหน้าตี๋ต้องหนีการจับคลุมถุงชนของมารดาไปเป็นหมออยู่บนดอยอันไกลโพ้น แต่แล้วชีวิตอันสงบสุขของเขากลับพังทลายเพราะผู้หญิงที่ชื่อ ขวัญชมัย หลานสาวเจ้าของรีสอร์ตแห่งเดียวบนนั้น เธอทั้งร้าย ยั่วยวน ปั่นป่วนหัวใจ ยิ่งอยู่ใกล้ยิ่งอยากบีบคอ แต่กลับต้องมาร่วมมือกันให้ความรู้ทางด้านสาธารณสุขกับชาวบ้านตามความประสงค์ของใครบางคน
อลวนละคราวนี้ เพราะนับวันแม่ตัวดียิ่งหนักข้อ ใช้ความเซ็กซี่เป็นอาวุธ หมายจะตีหมอหน้าใสใจซื่ออย่างเขาให้แตกพ่าย 
โถ...จะถูกจับกินตับอยู่รอมร่อแล้วยังไม่รู้ตัวอีกนะแม่คุณ!
"
3295,Lost in 2152 อนาคตทดลองรัก ทดสอบใจ,WEB_NOVEL,แทมทาราแรม,"MONDAY,THURSDAY",3,10620,9.19,139589,4290,COMPLETED,True,"โลกกลับตาลปัตรไปหมดเมื่อ ""วิไล"" สาวน้อยผู้มีพ่อเป็นนักวิทยาศาสตร์ ตื่นขึ้นมาแล้วพบว่าตัวเองอยู่ในโลกอนาคต!! ชั่วขณะที่กำลังแตกตื่นอยู่นั่นเอง เธอก็พบกับ ""สเวน"" หนุ่มหล่อมาดดีแต่นิสัยกวนXขั้นสุด แต่เพื่อเอาตัวรอดในโลกที่ไม่รู้จัก เธอจึงจำเป็นต้องเจราจาต่อรองเพื่อที่ซุกหัวนอนชั่วคราว แล้วการหาสารพันวิธีเพื่อกลับอดีตอันแสนปั่นป่วนชวนจักจี้หัวใจก็เริ่มต้นขึ้น!"
3294,After Rolling ฟิล์มร้อน อ้อนรัก,WEB_NOVEL,โมณฌา,SUNDAY,5,8135,9.39,235774,5596,COMPLETED,True,เรื่องราวของ 'มีนา' ที่แฝงตัวเข้ามาอยู่ในกองถ่ายซีรีส์เกาหลี เพื่อตามหาคนร้ายที่ฆ่าเพื่อนตัวเอง และนั่นทำให้เธอได้ใกล้ชิดกับ 'ลีวอนเฮ' พระเอกหนุ่มหล่อของกองถ่าย… ทั้งที่เขาก็เป็นผู้ต้องสงสัย แต่เขากลับทำให้เธอใจเต้นแรงได้ตลอด จนหวิดจะเสียตัวให้ (แบบเต็มใจ!!) ไม่รู้กี่ครั้ง!? มีนาจะจับตัวคนร้ายได้ก่อน หรือ จะตกหลุมรักวอนเฮซะก่อน (??)
3293,ป๊ะป๋าสายรุก,WEB_NOVEL,โมณฌา,"TUESDAY,FRIDAY",2,31813,9.37,935027,22270,COMPLETED,True,"‘หอมฟุ้ง’ ครูฝึกหัดในโรงเรียนอนุบาล เธอเกือบถูกทำมิดีมิร้ายในวัยมัธยม เหตุการณ์วันนั้นทำให้เธอสูญเสียความทรงจำและกลายเป็นโรคกลัวผู้ชาย 

ถึงแม้ปัจจุบันจะอาการดีขึ้นจนมีแฟนได้แล้ว แต่ก็ยังกลัว ‘การถูกสัมผัส’ จากเพศตรงข้ามอยู่ (กับแฟนหนุ่มก็ไม่เว้น!)

แต่ๆๆ ทำไมกันนะ!? ทำไม ‘ป๊ะป๋า’ ของนักเรียนในห้องคนหนึ่ง กลับสัมผัสเธอได้โดยที่เธอไม่รังเกียจเลยสักนิด…หนำซ้ำยัง ‘รู้สึกดี’ อีกต่างหาก!?"
3292,LOVE AT FIRST JOB งานยุ่งวุ่นรัก,WEB_NOVEL,ANYA,MONDAY,3,8638,9.7,136729,5140,COMPLETED,True,สมัยนี้ใครเขาแต่งงานเร็วกันล่ะคะ... แต่งงานตอนอายุ 50 ก็ยังไม่สาย แต่คนสวย เอ้ย! คนซวยอย่างฉัน กลับถูกพ่อจับคลุมถุงชนตอนอายุ 25 ปี แต่ไม่มีวันที่ฉันจะยอมทำตามคำสั่งแสนโบราณ ไม่มีทาง! งานนี้จะสู้เพื่ออิสรภาพสุดใจขาดดิ้น ฉันไม่ยอมตกเป็นทาสความรักจอมปลอมง่าย ๆ หรอกค่ะ
3291,The Countryman,WEB_NOVEL,Dix-sept17,THURSDAY,34,36236,9.46,540995,15766,ONGOING,False,"ผมชื่อ ""มาร์โลว์"" ใคร ๆ ก็บอกว่าผมหน้าตาดี ใช่ครับ ผมเป็นคนหล่อ แถมยังรวยมากอีกด้วย ชีวิตของผมไม่มีอะไรมากไปกว่าการเล่นโซเชียล และออกไปเที่ยวกินดื่มกับเพื่อน ๆ ผมใช้ชีวิตเอาแต่ใจ และไม่เคยแคร์ใคร จนกระทั่งวันที่พ่อหลอกพาผมมาทิ้งไว้ที่บ้านนอกเพื่อดัดนิสัย มองไปทางไหนก็มีแต่ทุ่งนา ต้นไม้ ควาย แล้วก็...""มุ่ย"" ไอ้เจ้าหนุ่มบ้านนอกเสียงเหน่อคนนี้ที่เอาแต่คอยตามติดผมอยู่เรื่อย ถึงจะรู้สึกว่าเขาน่ารำคาญ แต่ทำไมดันเผลอใจบางทุกครั้งเวลาที่เขาเข้าใกล้กันล่ะเนี่ย"
3290,Why me เมื่อฉันเกิดใหม่เป็นนางร้ายนิยายวาย,WEB_NOVEL,ใบสน / Baison,TUESDAY,34,22274,8.77,533639,16919,ONGOING,False,"ถ้าคุณเกิดมาเป็นสาววายในยุคที่วายเฟื่องฟู แสดงว่า คุณเป็นคนโชคดี แต่ถ้าคุณเกิดมาเป็นสาววาย ในนิยายวาย….คุณคือ ผู้มีบุญ

ฉันสาววายตัวแม่ ถูกรถชนในขณะที่กำลังอ่านฟิควาย “Why Me” ฟิควายที่ดังที่สุดในขณะนี้ จับพลัดจับผลูยังไงไม่รู้ พอลืมตาอีกที ฉันดันเข้าไปอยู่ในนิยายวายที่อ่านซะงั้น ฉันกลายเป็น “คะนิ้ง” ลูกคุณหนูสุดสวยดาวมหา’ลัย แฟนสาวของ “เหนือเมฆ” พระเอกของเรื่อง ที่ต้องไปพบรักกับ “ไอรัก” หนุ่มน่ารักปุ๊กปิ๊ก นายเอกของเรื่อง 
และใช่ค่ะ บทของฉันคือ นางร้าย แต่ติ่งโพแม่อย่างฉันจะจำใจร้ายกับทั้งคู่ได้ไง หลังจากนี้ ฉันจะฉีกทุกกฎของนางร้าย และจะสนับสนุนคู่นี้อย่างถวายชีวิต เพื่อชาบูความติ่งของตัวเองต่อไป #เหนือรัก จงเจริญ~~
"
3289,Take me home ไม่ให้มารับ,WEB_NOVEL,martian,SATURDAY,2,7862,8.68,108274,2820,COMPLETED,True,"พี่โรมคลั่งไคล้มอเตอร์ไซค์มาตั้งแต่สมัยมัธยม รักอิสระ เกลียดการนั่งในห้องเรียนมาก จึงชอบโดดเรียนไปขี่รถเล่น การเรียนกระท่อนกระแท่น แต่กลับผ่านมาจนถึงม. 6 ด้วยอิทธิพลของครอบครัว จนกระทั่งได้เรียนกับครูนุ่น ครูสอนคณิตศาสตร์จอมเคร่ง ที่บังคับให้เขาต้องเรียนเสริมทุกวันหลังเลิกเรียน การเรียนเสริมนั้นทำให้เขาได้รู้จักกับ อุ่น เด็กม.ต้นอัจฉริยะ ลูกของครูนุ่น ที่มักมาคอยเฝ้าเขาทำแบบฝึกหัดทบทวนบทเรียน และแอบติวให้เขาตอนครูนุ่นไม่อยู่ ความสัมพันธ์ในช่วงเวลาสั้น ๆ สร้างความผูกพันลึกซึ้ง ยังไม่ทันที่ทั้งคู่จะรู้ตัว ก็ต้องแยกจากกันไป เพราะพี่โรมสอบติดมหาวิทยาลัยที่จังหวัดอื่น...

เรื่องวายต่างวัยสุดละมุนที่จะทำให้คุณได้รู้จักความหมายของคำว่า ""ความรัก"""
3194,เพราะชีวิตต้องการความหวาน,ROMANCE,"Mul,Kahyun",FRIDAY,34,98127,9.12,2931089,95216,ONGOING,False,"""ซูยอน"" นักศึกษามหาวิทยาลัยที่สูญเสียอิสระจากการแต่งงานแบบคลุมถุงชน เธอตัดสินใจหย่าหลังจากที่ต้องทนทุกข์กับชีวิตแต่งงานถึง 3 ปี แต่แล้ว ""จีฮยอก"" สามีผู้แสนเย็นชากลับบอกให้เธอลองมาพยายามเรื่องความสัมพันธ์ด้วยกันเป็นครั้งสุดท้าย ทั้งที่ซูยอนตัดสินใจไปแล้ว แต่หัวใจกลับหวั่นไหวขึ้นมา 
 
เรื่องราวความรักระหว่างหญิงสาวผู้ตามหารักแท้ที่ไม่ใช่แค่แต่งงาน กับชายหนุ่มผู้อยากจะฉุดรั้งเธอไว้"
3193,รัตติกาลแห่งตราบาป,ROMANTIC_FANTASY,"kk,paeng",SUNDAY,1,102393,9.16,2768289,55835,COMPLETED,True,"เมื่อปู่ที่เลี้ยงดูตนเองเสียชีวิต อึนซอล หญิงสาวที่เกิดในคืนหิมะตกหนักและเติบโตท่ามกลางสนามรบ จึงเดินทางมายังคฤหาสน์ของ แม่ทัพกีแฮอุน ในฐานะอนุภรรยาซึ่งกำลังตั้งครรภ์ของบุตรชายคนโต

ท่ามกลางแผนร้ายและคำโกหก ค่ำคืนแห่งความผิดบาปก็ได้เริ่มต้นขึ้น..."
