title_id,title,genre,authors,weekdays,length,subscribers,rating,views,likes,status,daily_pass,synopsis
2418,Sweetie Calories ฟิตหุ่นลุ้นรัก,ROMANCE,JISARA,SATURDAY,40,62304,8.79,2525734,117579,HIATUS,False,"""แป้ง"" สาวผู้ยึดติดกับการที่มีแฟนเป็นคนหล่อเท่านั้น ต้องมาทำภารกิจลดน้ำหนักให้ ""พล"" อดีตหนุ่มหล่อสุดฮอตที่ปัจจุบันอ้วนกว่าร้อยโลเพื่อคบเป็นแฟนให้ได้ งานนี้จะสำเร็จหรือไม่ รักแท้ต้องน้ำหนักเท่าไร ติดตามได้ในฟิตหุ่นลุ้นรัก!"
2417,HOPEfully soon,ROMANCE,INVERT,SATURDAY,3,24419,9.81,765287,52218,COMPLETED,True,"""เดฟ"" เป็นโรคกลัวการเข้าสังคมจากการเกิดอุบัติเหตุ จึงตัดขาดจากผู้คนและเก็บตัวอยู่ในอะพาร์ตเมนต์ยาวนานเกือบ 2 ปี แต่แล้วเขากลับตกหลุมรักหญิงสาวปริศนาที่เขาเจอเสมอเมื่อยามหลับฝัน ในที่สุดเขาจึงตัดสินใจก้าวขาออกจากพื้นที่อันคุ้นเคย เพื่อตามหาเธอทั้งๆ ที่แทบไม่มีข้อมูลอะไรเลย เพื่อตามหาเธอ...คนที่เขาไม่รู้ว่ามีอยู่จริงไหมในโลกยามตื่น"
2398,X'MAS RUN,ACTION,Japonism,FRIDAY,3,59055,9.68,1645635,56392,COMPLETED,True,ในวันที่หิมะโปรยปรายในกรุงเทพ จอห์น อดีตทหารอเมริกันผู้มีภาวะเครียดหลังสงครามดันไปขัดขาแก๊งลักพาตัวเด็กเข้า จอห์นและสหายหน้าใหม่จะทำภารกิจส่งตัวเด็กคืนอ้อมอกแม่สำเร็จหรือไม่?!
2397,หอศิลป์ของฆาตกร,THRILLER,196.96655,WEDNESDAY,3,51293,9.8,1515428,82758,COMPLETED,True,"เมื่อนิทรรศการศิลปะถูกจัดแสดงในรูปแบบของการฆาตกรรมต่อเนื่อง โดยศิลปินหนุ่ม ฮุน ชาง 
อะไรกันที่ทำให้เขาก่อคดี? เขาคิดอะไรอยู่? ความจริงแล้วเกิดอะไรขึ้นกันแน่? จุดเริ่มต้นของเรื่องราวทุกอย่าง จะถูกเล่าผ่านปากของฮุนชางเอง"
2394,ผู้เล่นขั้นเทพแห่งหอคอยฝึกสอน,FANTASY,"บังกุซอก คิมซี,โอมากัม,ฮวังจูยอง",WEDNESDAY,64,342692,9.76,20527158,584774,ONGOING,False,‘คิมฮยอนอู’ ถูกปลดปล่อยหลังจากถูกกักกันอยู่ภายในหอคอยฝึกสอนนานนับ 12 ปี เขาออกมาพร้อมกับค่าความสามารถขั้นสุดที่พร้อมจะฟาดมอนสเตอร์ทุกตัวที่รุกรานโลก
2393,รักนี้เกินห้ามใจ [Nevertheless],ROMANCE,จองซอ,MONDAY,4,193797,9.79,6118153,138021,COMPLETED,True,"เว็บตูนต้นฉบับซีรีส์ดัง Nevertheless! ""นายก็รู้ใช่ไหมว่าฉันเป็นผีเสื้อ"" ความรักที่ห้ามใจไม่ได้ทั้งๆ ที่รู้ว่ามันจะทำลายตัวเอง"
2392,คฤหาสน์คนเพี้ยน,DRAMA,ยักกุก,MONDAY,7,22718,9.9,882207,68263,COMPLETED,True,ฉันเพิ่งออกจากงานและถูกไล่ออกจากห้องเช่า ระหว่างหางานใหม่ ฉันพักที่บ้านเพื่อน และในที่สุด ฉันก็พบงานที่เหมาะกับฉันบนอินเทอร์เน็ต มันคือ ตำแหน่ง 'แม่บ้าน' ซึ่งสามารถตอบโจทย์ได้ทั้งเรื่องงานและที่อยู่อาศัย...
2391,ในคำโกหก มีความรักซ่อนอยู่,ROMANCE,Aporo Kawai,WEDNESDAY,59,45024,9.38,1715955,88664,ONGOING,False,ภายใต้คำโกหกมักมีความจริงที่เราอยากจะซ่อนเอาไว้และเพื่อที่จะซ่อนความจริงทั้งหมดนั้นเราก็จะยิ่งพยายามโกหกต่อไปเรื่อยๆ
2390,จุมพิตรักพันธสัญญาแวมไพร์,ROMANTIC_FANTASY,Midnight Tea,MONDAY,3,66985,9.4,1794749,62296,COMPLETED,True,"เพียงจูบเดียว เราต่างเป็นของกันและกันชั่วนิรันดร์...

""วิณณ์"" แวมไพร์ชั้นต่ำผู้มีอีกร่างเป็นกระต่าย บังเอิญจูบกับ ""มิรา"" สาวน้อยเลือดบริสุทธิ์ผู้ถูกหมายปองโดย ""ชาร์ลส์"" แวมไพร์ชั้นสูง สำหรับแวมไพร์ การจูบหมายถึงการทำพันธสัญญา และการถอนพันธสัญญา มีเพียงความตายเท่านั้น ศึกชิงนางระหว่างแวมไพร์ต่างสายพันธุ์จึงเริ่มต้นขึ้น"
2389,ถูกใจนายติดอ่างที่รัก,BL_GL,แผ่นทองสีดำ,MONDAY,49,251688,9.86,14538267,695938,ONGOING,False,"ติดอ่างไม่เป็นไร เพราะฉันก็ติดใจนายเหมือนกัน...

""แว่นดินสอ"" หนุ่มสุดแนวผู้มีสไตล์เป็นของตัวเอง บังเอิญรู้ความลับบางอย่างของ ""กระดาษ"" หนุ่มติดอ่างผู้เป็นทั้งเพื่อนบ้าน และเพื่อนที่ทำงาน แว่นดินสอพยายามแบล็กเมลนายกระดาษ แต่ด้วยความน่ารัก และจิตใจดีของเขา ทำให้แว่นดินสอเผลอตกหลุมรักนายกระดาษไปโดยไม่รู้ตัว  แต่ปัญหาคือ นายกระดาษดันมีคนที่ชอบอยู่แล้ว แถมเป็นสาวฮอตประจำออฟฟิศอย่าง ""กุหลาบ"" เสียด้วย แล้วแว่นดินสอจะเปลี่ยนใจนายกระดาษได้ไหมนะ?"
2388,เรื่องเล่า สุดประหลาด 2,HORROR,ซองแด โอ,FRIDAY,65,81291,9.8,6326223,222475,ONGOING,False,"ประหลาดกว่านี้ไม่มีอีกแล้ว 
รวมเรื่องเล่าสุดประหลาดที่จะทำให้เข้าใจความหมายของคำว่า “เหนือจินตนาการ” ได้ลึกซึ้งขึ้น"
2387,เรื่องเล่าของพี่สาวที่ออฟฟิศ,ROMANCE,"วาซักบาซัก,คิมจาเน,ปัลเมย์โร่",THURSDAY,65,84270,9.62,3283319,124529,ONGOING,False,เรื่องราวของผมกับพี่สาวในออฟฟิศ​ที่ทำงานด้วยกัน​ ยิ่งใกล้ชิดกัน​ เธอยิ่งทำให้ผมใจเต้น​ แต่รักครั้งนี้คงเป็นไปไม่ได้เพราะ...
2386,วาร์ปรักเสิร์ฟใจคุณนักเขียน,ROMANCE,"ทู่เกอเชาเปากู่,ป๋ายสยง",WEDNESDAY,67,124266,9.73,4731832,224462,ONGOING,False,"ถ้าจูบลายเซ็นบนปกในของหนังสือ จะย้ายไปอยู่ข้างกายนักเขียนที่ชอบที่สุดได้ในพริบตา?
""อันเล่อ""ได้หนังสือพร้อมลายเซ็นของนักเขียนสุดโปรดมาจาก ""อวี้เจิ้งหย่า"" แต่เมื่อเธอจุ๊บลงบนปกหนังสือ ปาฏิหาริย์ก็เกิดขึ้น เธอวาร์ปไปอยู่ข้างกายเขา นี่มันเป็นไปได้อย่างไรกันเนี่ย?!! 
"
2385,The Sinners,BL_GL,DuchessAuburn,TUESDAY,46,85197,9.89,3304543,183357,ONGOING,False,ในโลกที่มนุษย์กลายเป็นปีศาจจากความรู้สึกและอารมณ์ในจิตใจเป็นเรื่องปกติ “เลือดสีดำ” กลับกลายเป็นสิ่งที่แปลกประหลาดและไม่เคยมีใครเห็นมาก่อน แคร์รี่ สเตลลิน คือชายผู้ได้เห็นเลือดสีดำเป็นคนแรกในบ้านของเขาที่เกลื่อนกลาดไปด้วยศพเมื่อ 5 ปีก่อน และในการจะไขปริศนาของเลือดสีดำ แคร์รี่ต้องร่วมมือกับ อาเธอร์ ซึ่งเป็นคนที่ไม่เคยรู้จักกันมาก่อน ทว่าการตามหาเบื้องหลังของเลือดสีดำนั้นอาจไม่ได้ง่ายเหมือนที่พวกเขาคิดเอาไว้
2380,เด็กใหม่ห้องคิง,DRAMA,"ซงแชยุน,ชินแจยอง",SUNDAY,70,202044,9.84,10449007,475937,ONGOING,False,"""ย่านนี้มันเป็นบ้าอะไร...? เด็กทุกคนเรียนล่วงหน้ากันหมด หนูเรียนตามไม่ทันเลย... ที่โรงเรียนก็ไม่ยอมสอน ที่กวดวิชาก็ไม่ยอมสอน... หนูต้องเข้าคณะแพทย์นะ..."""
2374,เมนูป่วนก๊วนกระทะเหล็ก,DRAMA,ส้มฉุน,THURSDAY,66,63460,8.57,3609808,171316,ONGOING,False,หนูแฮม ลูกสาวเชฟชื่อดังระดับโลก ผู้ใฝ่ฝันอยากเป็นเชฟตามพ่อของเธอ แต่เธอกลับมีปํญหากวนใจอยู่นิดเดียว คือ เธอกลัวน้ำมัน กลัวน้ำเดือด กลัวมีดบาด เกลียดกลิ่นคาวปลา ไม่มีแรงแม้แต่จะยกกระทะ !!
2373,RAIN วันที่ฝนเผาใจ,ROMANCE,"Queen B,Mungonfly",TUESDAY,3,74561,9.57,2589817,140862,COMPLETED,True,เมื่อวันวิวาห์ที่ฝันกลับล่มลงอย่างไม่มีสาเหตุ 'ซอล' จึงตัดสินใจหอบหัวใจช้ำๆ กลับมาบ้านเกิด แต่แล้วโลกก็เหวี่ยงเธอให้มาพบผู้ชาย 3 คนที่ทำให้เธอต้องใจเต้น เธอจะทำอย่างไรกับมรสุมรักที่ไม่มีทางหยุดนี้ แล้วใครจะเป็นคนสุดท้ายที่รออยู่เมื่อม่านฝนซา
2356,Return To Player,FANTASY,"เซฮน,Index",THURSDAY,62,207284,9.8,12436980,373194,ONGOING,False,เมื่อ 10 ปีก่อนโลกใบนี้ได้กลายมาเป็นฉากของ 'เกม' พวกเราได้กลายมาเป็น 'ผู้เล่น' ของเกมนั้นและต้องฆ่ามอนสเตอร์เพื่อเอาชีวิตรอด และผลลัพธ์คือ...การล่มสลายของมนุษยชาติ
2355,เจ้าหนุ่มพลังถอด,COMEDY,ยุนโซฮัม,SATURDAY,69,38840,8.41,1698419,51764,ONGOING,False,คังฮาจิน เด็กหนุ่มแสนธรรมดาผู้มีความใฝ่ฝันอยากจะเป็นฮีโร่ วันหนึ่งพลังพิเศษสุดประหลาดของเขาได้ตื่นขึ้นมา เมื่อใครสัมผัสมือจะถูกเปลื้องผ้าจนเปลือยเปล่าทันที แล้วแบบนี้ฮาจินจะเป็นฮีโร่สุดเท่อย่างที่หวังได้หรือไม่!? 
2354,เบ้าหน้าฟ้าประทาน,DRAMA,จีเอ,FRIDAY,70,172638,9.58,8532395,303000,ONGOING,False,ใบหน้าที่แม้แต่เด็กที่กำลังร้องไห้ยังต้องหยุดร้อง ตั้งแต่หัวจรดเท้าที่ทุกสายตาต่างจับจ้องแม้อยู่ท่ามกลางสายฝน ผู้ชายที่ทำให้ความเร่งรีบบนท้องถนนหยุดซะงักเสมอ คนคนนั้นก็คือผม จอนจีอุง
2353,บันทึกรักของแม่มดกับนายมังกร,ROMANTIC_FANTASY,"Dimang,New lung,Baridal",WEDNESDAY,67,336434,9.75,15924071,634086,ONGOING,False,"""เวนดี้ บลันเชตต์"" แม่มดผู้เป็นอัจฉริยะโดยกำเนิดตกอยู่ในวังวนอันน่าอัปยศ"
2342,BAD GUY,COMEDY,ดุมส์,THURSDAY,71,362008,9.84,25618618,604708,ONGOING,False,คังจีอุงใช้ชีวิตเป็นคนดีมาตลอด 10 ปีเพราะซูจิน คนที่เขาชอบเคยบอกว่าชอบคนดี แต่หลังจากเห็นซูจินคบกับเด็กเกเร จีอุงก็ตัดสินใจใหม่ ว่าจะพยายามเป็นคนเลวกว่าคนที่ซูจินคบให้ได้!
2341,เมื่อซินเดอเรลล่าตื่นจากฝัน,ROMANCE,"ซันชา,ไอโกเม",TUESDAY,71,88521,9.37,2847454,122782,ONGOING,False,2 เดือนหลังจากฮายุนซอรู้ว่าซอจูวอนแฟนของเธอเป็นทายาทมหาเศรษฐี แม่ของซอจูวอนก็ใช้เงินจ้างเธอเพื่อให้ทั้งสองคนเลิกกัน ฮายุนซอจึงจำเป็นต้องทำทุกทางเพื่อเลิกกับเขา แต่ซอจูวอนกลับพยายามที่จะเปลี่ยนใจเธอ...
2340,เกลียดนักต้องมารักคนอย่างเธอ,ROMANCE,"Egg Burge,bless",TUESDAY,69,124093,9.36,4413167,155305,COMPLETED,False,กงเสี่ยวยู่ กับ หวงอีอี เป็นคู่แต่งงานที่อยู่ในช่วงหมดโปรโมชัน แต่การบอกเลิกกะทันหันของหวงอีอีกับอุบัติเหตุไม่คาดฝัน ทำให้ชีวิตของทั้งคู่เปลี่ยนแปลงไป
2336,เมื่อสามีจอมบงการของฉันเปลี่ยนไป,ROMANTIC_FANTASY,"ลันเทเชียส,ชังบี,เมาท์เท่น",WEDNESDAY,72,280895,9.6,11804328,427207,ONGOING,False,"นึกว่าในชีวิตนี้จะไม่มีอะไรให้นึกเสียดายแล้วซะอีก เพราะที่ผ่านมายังไม่เคยมีอะไรเป็นไปตามที่เราต้องการเลยแม้แต่อย่างเดียว ตลอดช่วงเวลาหลายปีที่เคยโดนกดขี่ข่มเหงเพียงเพราะว่ามีสาวใช้ซึ่งเป็นสายเลือดอันต่ำต้อยเป็นผู้ให้กำเนิด...จึงทำให้ไม่เคยได้รับแม้แต่ความรักจากครอบครัวหรือชีวิตอันสุขสบายในวงศ์ตระกูลเลยแม้แต่ครั้งเดียว
แต่ฉันยังไม่อยากตาย ฉันอยากจะมีชีวิตอย่างที่ใจต้องการบ้างแม้จะแค่ชั่วพริบตาเดียว..."
2335,รักใสๆ ของยอนอู,ROMANCE,ลีซล,TUESDAY,63,114621,9.82,5242135,274191,ONGOING,False,"""ตอนนี้ผมกำลังแอบรักเธอข้างเดียว"""
2333,Build Up,DRAMA,911,FRIDAY,73,122281,9.76,10512610,246121,ONGOING,False,"""อยากเล่นฟุตบอลจัง อยากเล่นฟุตบอลให้เก่งขึ้นกว่านี้ ไม่สิ เราอยากที่จะเล่นฟุตบอลให้เก่งที่สุด เท่านั้นเอง"""
2332,หนีรักจักรพรรดิบ้าเลือด,ROMANTIC_FANTASY,"รยูรัน,SF_JD",MONDAY,53,278061,9.7,15041100,527026,ONGOING,False,อาณาจักรได้จัดงานเทศกาลครั้งใหญ่ขึ้นปีละครั้ง  ในวันนี้ทุกๆ คนจะออกมาสนุกสนานกันตามท้องถนนในยามค่ำคืน และฉันเองก็เป็นหนึ่งในนั้นจนถึง...
2330,ราวลมพัดกิ่งไม้แห้ง,ROMANTIC_FANTASY,"ดัลแซอุล,ฮวาอึม",THURSDAY,73,194121,9.82,11364431,544411,ONGOING,False,ลีเอตต้า ทริสตี้ เป็นหญิงหม้ายที่เสียสามี ถูกแย่งลูก และใกล้จะถูกฝังทั้งเป็นพร้อมกับศพของเอิร์ลคาซาเรียส แต่ในงานศพของคาซาเรียสแขกที่ไม่ได้เชิญอย่างแกรนด์ดยุกแอกเซียสผู้มีฉายาว่าเจ้าชายเสียสติปรากฏตัวมาช่วยชีวิตลีเอตต้า “ว่าไง นางยั่วสวาท”
2329,สายใยรักอุดมคติ,ROMANCE,ยัดกง,MONDAY,5,41291,9.48,1614545,85202,COMPLETED,True,ซาฮีแอบเห็นฉากจูบระหว่างเพื่อนผู้ชายสองคนเข้าโดยบังเอิญ แล้วหนึ่งในนั้นยังเป็นคนที่เธอเคยชอบอีกต่างหาก! เมื่อซาฮีต้องมาใช้ชีวิตอยู่ในบ้านหลังเดียวกับพวกเขา ความสัมพันธ์อันแปลกประหลาดก็เริ่มต้นขึ้น...
2318,7 จอมมาร,ROMANTIC_FANTASY,doublebee,THURSDAY,73,101561,9.79,4527375,226562,ONGOING,False,"เมื่อปีศาจตนหนึ่งคิดครองโลก 
6 พี่น้องที่เหลือจึงต้องออกตามหา
แต่โลกมนุษย์มีแต่เรื่องสนุก
งั้นไม่ต้องคงต้องครองโลกกันแล้วโว้ย !!"
2317,ขอโทษครับ ผมไม่ใช่คนแถวนี้,COMEDY,"Moname,เด็กชายตาขีด",THURSDAY,68,96393,9.72,3902189,198637,ONGOING,False,ผมเป็นนักเรียนม.ปลายธรรมดาๆ มาตลอดจนกระทั่งวันนี้...ที่ผมได้รู้ความจริงบางอย่างที่พ่อแม่ปิดบังผมมาตลอด 16 ปี ความจริงสุดช็อกนั้นก็คือ...?!!
2293,ผมถูกรักแรกไล่ฆ่า,ACTION,Nicname,SUNDAY,3,63978,9.41,2598534,93768,COMPLETED,True,"""เทน"" เด็กหนุ่มผู้ได้พบกับ ""มายด์"" รักแรกที่กวดวิชาพิเศษ วันที่เขาตัดสินใจสารภาพรักกับเธอ กลับเป็นวันที่ชีวิตของเขาเปลี่ยนไปเมื่อมายด์ได้ออกตามล่าเทนอย่างไม่หยุดยั้ง แล้วเทนจะทำอย่างไร"
2292,อย่ามาหลอกซะให้ยาก,ROMANCE,"aurum;),yoyongSAN",WEDNESDAY,4,186828,9.72,8478653,384199,COMPLETED,True,"""วารี"" สาวมหาวิทยาลัยหน้าตาระดับตัวประกอบ C ดันมีผู้ชายหน้าตาดี ""ชาฮุน"" มาสารภาพรัก วารีได้แต่หวนคิดว่าความรักครั้งนี้คืออะไร มีจุดประสงค์ไม่ดีหรือเปล่า อย่ามาหลอกกันนะ!!"
2288,คู่รักหวานซ่อนเปรี้ยว,ROMANCE,"จังกรีน,โฟลว์บี",SATURDAY,72,149707,9.86,9887813,495272,COMPLETED,False,"""เราแค่อยู่ด้วยกันเพื่อรอวันหย่า""
ชายหญิงที่เคยเป็นคู่ปรับกันสมัยเรียนมัธยมมาเจอกันอีกครั้งในรอบ 10 ปี แต่ครั้งนี้เขาและเธอเจอกันในฐานะคู่แต่งงานปลอมเพื่อบรรลุเป้าหมายของตัวเอง ชายหญิงคู่นี้จะได้ใช้ชีวิตแต่งงานอย่างสำเร็จลุล่วงไปได้ด้วยดีหรือไม่?"
